番号,難易度,問題文,回答,ボタン1,ボタン2,ボタン3,ボタン4,説明1,説明2,説明3,説明4
54,easy,最も強い噛む力を持つ動物はどれですか？,ナイルワニ,ヒョウ,ナイルワニ,ライオン,トラ,ヒョウも強い噛む力を持っていますが、ワニほどではありません。,ナイルワニは最も強い噛む力を持ち、その力は約 5000ポンドに達します。,ライオンは強い噛む力を持っていますが、ワニほどではありません。,トラも強い噛む力を持っていますが、ワニほどではありません。
55,hard,最も長い距離を移動する哺乳類はどれですか？,クジラ,ヒト,トナカイ,カリブー,クジラ,ヒトは長距離を移動することができますが、クジラほどではありません。,トナカイは毎年数千キロメートルを移動しますが、クジラほどではありません。,カリブーは毎年数千キロメートルを移動しますが、クジラほどではありません。,クジラ、特にザトウクジラは年間約 8000 キロメートルを移動します。
56,normal,最も大きな目を持つ動物はどれですか？,イカ,イカ,フクロウ,クジラ,ゾウ,イカの目は直径約 30 センチメートルに達します。,フクロウは大きな目を持っていますが、イカほどではありません。,クジラは大きな目を持っていますが、イカほどではありません。,ゾウは大きな目を持っていますが、イカほどではありません。
57,easy,最も音に敏感な動物はどれですか？,コウモリ,ウサギ,イヌ,コウモリ,ネコ,ウサギは非常に敏感な耳を持っていますが、コウモリほどではありません。,イヌは非常に敏感な耳を持っていますが、コウモリほどではありません。,コウモリはエコーロケーションを使用して音を非常に敏感に感じ取ります。,ネコは非常に敏感な耳を持っていますが、コウモリほどではありません。
58,hard,最も高く飛ぶことができる鳥はどれですか？,オオアマサギ,ハクトウワシ,オオアマサギ,ツバメ,ペリカン,ハクトウワシは高く飛ぶことができますが、オオアマサギほどではありません。,オアマサギは飛行高度が最大で 1 万メートルに達することがあります。,ツバメは高く飛ぶことができますが、オオアマサギほどではありません。,ペリカンは高く飛ぶことができますが、オオアマサギほどではありません。
59,easy,最も多くの種類の花粉を運ぶことができる動物はどれですか？,ハチ,ハチ,チョウ,コウモリ,ハチドリ,ハチは多くの種類の花粉を運び、植物の受粉に重要な役割を果たします。,チョウも花粉を運びますが、ハチほど多くの種類の花粉を運びません。,コウモリも花粉を運びますが、ハチほど多くの 種類の花粉を運びません。,ハチドリも花粉を運びますが、ハチほど多くの種類の花粉を運びません。
60,normal,最も小さな哺乳類はどれですか？,トガリネズミ,ハムスター,ネズミ,ウサギ,トガリネズミ,ハムスターは小さな哺乳類ですが、トガリネズミほど小さくはありません。,ネズミは小さな哺乳類ですが、トガリネズミほど小さくはありません。,ウサギは小さな哺乳類ですが、トガリネズミほど小さくはありません。,トガリネズミは最も小さな哺乳類で、体長は約 5 センチメートルです。
61,hard,唯一の毒を持つ哺乳類はどれですか？,カモノハシ,ハリネズミ,カモノハシ,ウサギ,モグラ,ハリネズミは毒を持ちません。,カモノハシのオスは後肢に毒針を持ちます。,ウサギは毒を持ちません。,モグラは毒を持ちません。
62,hard,最も大きなカエルはどれですか？,ゴライアスガエル,ツノガエル,アマガエル,ゴライアスガエル,ウシガエル,ツノガエルは大きなカエルですが、ゴライアスガエルほどではありません。,アマガエルは小さなカエルです。,ゴライアスガエルは最大で体長 30 センチメートル、体重 3 キログラムになります。,ウシガエルは大きなカエルですが、ゴライアスガエルほどではありません。
63,easy,最も高く飛び跳ねる昆虫はどれですか？,バッタ,バッタ,コオロギ,ゴキブリ,アリ,バッタは自身の体長の数倍の高さまで飛び跳ねることができます。,コオロギは高く飛び跳ねますが、バッタほどではありません。,ゴキブリは飛び跳ねることができますが、バッタほどではありません。,アリは高く飛び跳ねることはできません。
64,easy,最も多くの種類の植物を食べる動物はどれですか？,ヤギ,パンダ,ゴリラ,ヤギ,ゾウ,パンダは竹を主食としていますが、他の植物も食べます。しかし、ヤギほどではありません。,ゴリラは多くの種類の植物を食べますが、ヤギほどではありません。,ヤギは非常に多くの種類の植物を食べることができます。,ゾウは多くの種類の植物を食べますが、ヤギほどではありません。
65,easy,最も強い握力を持つ動物はどれですか？,ゴリラ,チンパンジー,オランウータン,ヒト,ゴリラ,チンパンジーも強い握力を持っていますが、ゴリラほどではありません。,オランウータンも強い握力を持っていますが、ゴリラほどではありません。,ヒトの握力はゴリラほど強くありません。,ゴリラの握力は最大で約 500 キログラムに達します。
66,normal,最も長く生きる魚はどれですか？,コイ,ヒラメ,コイ,サメ,マグロ,ヒラメも10～20年生きるようですが、コイほど長生きではありません。,コイは 100 年以上生きることがあります。,サメは長寿の魚ですが、コイほどではありません。,マグロは長寿の魚ですが、コイほどではありません。
67,easy,最も速く空を飛ぶ鳥はどれですか？,ハヤブサ,ハト,ツバメ,スズメ,ハヤブサ,ハトは速く飛びますが、ハヤブサほどではありません。,ツバメは速く飛びますが、ハヤブサほどではありません。,スズメは速く飛びますが、ハヤブサほどではありません。,ハヤブサは急降下時に時速 300 キロメートル以上で飛ぶことができます。
68,hard,次の動物の中で、最も高くジャンプすることができるのはどれでしょう？,リス,リス,カラス,ネズミ,ウサギ,リスは非常に高くジャンプすることができます。大人のリスの場合、軽く２メートルは跳ぶことができるようです。,カラスは飛ぶことができますが、ジャンプするのは高くありません。リスほど高くジャンプしません。,ネズミは高くジャンプすることができますが、リスほどではありません。,ウサギは高くジャンプすることができますが、リスほどではありません。
69,hard,最も小さな鳥はどれですか？,ハチドリ,スズメ,ハチドリ,カナリア,ツバメ,スズメは小さな鳥ですが、ハチドリほどではありません。,ハチドリは世界で最も小さな鳥で、その体長は約 5 センチメートルです。,カナリアは小さな鳥ですが、ハチドリほどではありません。,ツバメは小さな鳥ですが、ハチドリほどではありませ ん。
70,easy,最も長い舌を持つ哺乳類はどれですか？,アリクイ,クマ,キリン,アリクイ,ライオン,クマの舌は約 25 センチメートルです。しかし、アリクイの舌は約 60 センチメートルにもなるのでかないません。,キリンの舌は約 45 センチメートルです。しかし、アリクイの舌は約 60 センチメートルにもなるのでかないません。,アリクイの舌は約 60 センチメートルにもなります。,ライオンの舌は約 15 センチメートルです。しかし、アリクイの舌は約 60 センチメートルにもなるのでかないません。
71,easy,最も長い尾を持つ鳥はどれですか？,クジャク,ワシ,ハト,スズメ,クジャク,ワシの尾は長いですが、クジャクほどではありません。,ハトの尾は長いですが、クジャクほどではありません。,スズメの尾は長いですが、クジャクほどではありません。,クジャクの尾は最大で 2 メートルに達します。
72,hard,首の骨の数が最も多い動物はどれでしょうか？,ナマケモノ,ヒト,ナマケモノ,キリン,マナティ,ヒトの首の骨の数は、７本です。ナマケモノの1種である「ミユビナマケモノ」は、首の骨が9本ある珍しい体の作りとなっています。,ナマケモノも基本的には同じく首の骨の数は7本ですが、ナマケモノの1種である「ミユビナマケモノ」は、首の骨が9本ある珍しい体の作りとなっています。,キリンはヒトよりも圧倒的に長い首を持っていますが、大きな骨7本で成り立っています。ナマケモノの1種である「ミユビナマケモノ」は、首の骨が9本あるので、キリンの首の骨の数が多くないのです。,マナティの首の骨の数は、６本です。ナマケモノの1種である「ミユビナマケモノ」は、首の骨が9本ある珍しい体の作りとなっています。
73,hard,ゾウはなぜ鼻が長くなったでしょうか？,泳いでいる時に息継ぎがしやすいから,エサが食べやすいから,体が掻きやすくなるから,物を掴みやすいから,泳いでいる時に息継ぎがしやすいから,ゾウの鼻は、器用に動かしてエサを食べたりできますが、別の理由で鼻が長くなったといわれています。,ゾウの鼻は、器用に動かすことができるので、体も掻きやすいと思いますが、別の理由で鼻が長くなったといわれています。,ゾウの鼻は骨がなく、筋肉の塊のようなものなので、物も掴みやすいと思いますが、別の理由で鼻が長くなったといわれています。,ゾウは泳ぐのも得意な生き物であり、川を渡って移動することもあります。その際に、鼻をシュノーケルのように使うと息継ぎがしやすくなるため、徐々に長い鼻の生物に進化していったと言われています。
74,hard,動物は様々な模様を持っていますが、地肌の色と体の模様の色が同じとは限りません。では、地肌と体の模様の色が同じ動物はどれでしょうか？,牛,牛,シマウマ,キリン,クマ,牛の一種である「ホルスタイン」は地肌と体の模様が同じ色をしています。,シマウマの地肌は、灰色です。なので、地肌と体の模様の色が同じではありません。,キリンの地肌は、黒みがかった肌色です。なので、地肌と体の模様の色が同じではありません。,クマ（ツキノワグマやヒグマ）の地肌は、黒色です。なので、地肌と体の模様の色が同じではありません。
75,normal,猿の1種「スローロリス」は、他の猿には無い特徴があります。それはなんでしょうか？,毒がある,アルファベットを認識できる,しっぽで歩ける,毒がある,エラ呼吸ができる,スローロリスは、アルファベットを認識できません。,スローロリスのしっぽは退化して毛の下に覆い隠されているので、しっぽで歩くことはできません。,スローロリスは、哺乳類としては珍しい毒を持った生き物です。上腕腺から出る分泌物を唾液と混ぜることによって、有害物質を生成することができます。毛づくろいをしながら毒を全身に広げることで、天敵から身を守っています。,スローロリスは、エラ呼吸はできません。
76,easy,世界三大珍獣の1匹「オカピ」。一見するとシマウマに似ているように見えますが、馬ではありません。何の仲間でしょうか？,キリン,牛,トラ,ウマ,キリン,オカピは、牛の仲間じゃないよ。,オカピは、トラの仲間じゃないよ。,オカピは、ウマの仲間のような見た目をしているけど、ウマの仲間じゃないよ。,そう、オカピは、馬の仲間のような見た目をしているけど、分類上はキリンの仲間だよ。キリンの先祖に近い姿だと言われているよ。
77,normal,まるで笑っているかのような名前の動物がいます。実在するのはどれでしょうか？,クスクス,ニコニコ,クスクス,ゲラゲラ,ケタケタ,ニコニコ、という名前の動物は、実在しないよ。,クスクス、という名前の動物は実在するよ。オーストラリアに棲息していて、カンガルーやコアラと同じように、子どもを育てるための袋を持っているよ。,ゲラゲラ、という名前の動物は、実在しないよ。,ケタケタ、という名前の動物は、実在しないよ。
78,normal,ブタの体脂肪率はどのくらいでしょうか？,体脂肪率１５％,体脂肪率１５％,体脂肪率３０％,体脂肪率４５％,体脂肪率６５％,そうなんだ、「ブタは太っている」というイメージがあるけど、ブタの体脂肪率は１５％と少ないんだよ。,「ブタは太っている」というイメージがあるけど、ブタの体脂肪率は、３０％もないよ。,「ブタは太っている」というイメージがあるけど、ブタの体脂肪率は、４５％もないよ。,「ブタは太っている」というイメージがあるけど、ブタの体脂肪率は、６５％もないよ。
79,hard,「流氷の天使」とも呼ばれる可愛らしい生き物「クリオネ」は何の仲間でしょうか？,貝,クラゲ,プランクトン,イカ,貝,クリオネは、クラゲの仲間ではないよ。殻を持たない巻貝の一種になるんだ。,クリオネは、プランクトンの仲間ではないよ。殻を持たない巻貝の一種になるんだ。,クリオネは、イカの仲間ではないよ。殻を持たない巻貝の一種になるんだ。,クリオネは、とてもそうは見えませんが殻を持たない巻貝の一種です。1月下旬に流氷とともに北海道の方にやって来ます。その可愛らしい姿が合わさって、「流氷の天使」と呼ばれるようになりました。
80,easy,ワニが水中で目を開けていられるのはなぜでしょうか？,目を保護する膜を持っているから,眼球が分厚くて水を弾いてくれるから,もの凄く我慢強いから,目を保護する膜を持っているから,水中で空気の泡を作って目の周りを囲んでいるから,ワニの目が水中で目を開けていられるのは、眼球が分厚くて水を弾いてくれるからじゃないよ。,ワニの目が水中で目を開けていられるのは、もの凄く我慢強いからじゃないよ。,ワニの目には、「瞬膜」という水中で目を守る膜があります。瞬膜が閉じると目がすりガラスのような状態になり、人間で言えばゴーグルを装着したような状態なので、水中でも目を開けていることができます。,ワニの目が水中で目を開けていられるのは、水中で空気の泡を作って目の周りを囲んでいるからじゃないよ。
81,normal,ネコ科の動物は、基本的に爪を出したり引っ込めたりできます。しかし、爪が出たままで引っ込めることができないネコ科もいます。それはなんでしょうか？,チーター,ライオン,チーター,トラ,ピューマ,ネコ科の動物の爪は、必要のないときは引っ込めることができます。ライオンも爪を引っ込めることができるので違うよ。,ネコ科の動物の爪は、必要のないときは引っ込めることができます。しかしチーターの場合は、生後10ヶ月あたりから引っ込めることができなくなります。チーターは最も早く走ることができる動物であり、その爪は武器であると同時にスパイクシューズのような役割も兼ね備えています。,ネコ科の動物の爪は、必要のないときは引っ込めることができます。トラも爪を引っ込めることができるので違うよ。,ネコ科の動物の爪は、必要のないときは引っ込めることができます。ピューマも爪を引っ込めることができるので違うよ。
82,hard,バクはおしっこをとても遠くまで飛ばすことができます。その飛距離はどのくらいでしょうか？,５m,１m,３m,５m,１０m,バクのおしっこは、１mよりももっと遠くに噴射されることがあるよ。,バクのおしっこは、３mよりももっと遠くに噴射されることがあるよ。,バクのおしっこは後ろ向きに霧状に散布され、最大で５mは噴射されることがあるよ。こうすることでバクはマーキングをし、自分の縄張りを主張しているんだ。,バクのおしっこは、さすがに１０mも遠くには噴射されないよ。
83,hard,ハゲワシはその名のとおり、頭に毛がない鳥です。その理由はなんでしょうか？,病気を予防できるから,その方が涼しいから,外敵が苦手な模様に見えるから,威嚇するため,病気を予防できるから,頭に毛がないから涼しそうだけど、理由は違うよ。,確かに外敵が苦手な模様に見えるけど、理由は違うよ。,頭に毛がないと、威嚇しているように見えるかもしれないけど、理由は違うよ。,ハゲワシは、動物の死骸に頭をつっこんで食事をします。頭に毛があると菌が繁殖して病気になりやすいから、病気から身を守るため頭に毛がないよ。
84,normal,世界最大のネズミの仲間「カピバラ」の走る速さはどのくらいでしょうか？,時速５０km,時速１０km,時速２０km,時速３５km,時速５０km,カピバラは、のんびりしたイメージを持たれがちな動物ですが、時速１０kmよりも速く走るよ。,カピバラは、のんびりしたイメージを持たれがちな動物ですが、時速２０kmよりも速く走るよ。,カピバラは、のんびりしたイメージを持たれがちな動物ですが、時速３５kmよりも速く走るよ。,カピバラは、のんびりしたイメージを持たれがちな動物ですが、天敵から逃げるために時速５０kmもの速さで走ることができるよ。
85,hard,クジラとイルカの違いはなんでしょうか？,大きさが一定以上かそれ以下か,知能が一定以上かそれ以下か,大きさが一定以上かそれ以下か,どのくらいの深さまで潜れるか,高くジャンプできるかそうでないか,クジラとイルカは、どちらも「クジラ目」に分類される生き物です。知能が一定以上かそれ以下か、という違いの分類ではないよ。,クジラとイルカは、どちらも「クジラ目」に分類される生き物です。「大人になった時の体長が4mを越すものはクジラ・それ以下はイルカ」というように、大きさが一定以上かそれ以下か、という違いで分類されているよ。,クジラとイルカは、どちらも「クジラ目」に分類される生き物です。どのくらいの深さまで潜れるか、という違いの分類ではないよ。,クジラとイルカは、どちらも「クジラ目」に分類される生き物です。高くジャンプできるかそうでないか、という違いの分類ではないよ。
86,normal,クアッカワラビーは、いつもニコニコと笑っているかのように見える顔をしています。そのことから付けられた別名はなんでしょうか？,世界一幸せな動物,世界一幸せな動物,世界一平和な動物,世界一楽しそうな動物,世界一かわいい動物,クアッカワラビーは、オーストラリアに棲息する動物です。特徴的なのは、まるでニコニコと笑っているかのような可愛らしい顔です。そのことから、「世界一幸せな動物」とも呼ばれるようになりました。,クアッカワラビーは、オーストラリアに棲息する動物です。別名は「世界一平和な動物」ではないよ。,クアッカワラビーは、オーストラリアに棲息する動物です。別名は「世界一楽しそうな動物」ではないよ。,クアッカワラビーは、オーストラリアに棲息する動物です。別名は「世界一かわいい動物」ではないよ。
87,easy,馬が歯を見せる表情をすることがありますが、この時の馬はなにをしているのでしょうか？,匂いを感じ取ろうとしている,目の前の相手を威嚇している,匂いを感じ取ろうとしている,歯に挟まったエサを取ろうと頑張っている,笑っている,馬が歯を見せる表情は、目の前の相手を威嚇している訳ではないよ。,その通り、馬が歯を見せる表情は、匂いを感じ取ろうとしているんだ。「フレーメン反応」と呼ばれるもので、匂いの成分をより多く感じ取ろうとする時に見せるよ。繁殖期を迎えたメスが近くにいる時や、アルコールなどの刺激のある匂いを感じた時によく見られるよ。,馬が歯を見せる表情は、歯に挟まったエサを取ろうと頑張っている訳ではないよ。,馬が歯を見せる表情は、「馬が笑っている」と言われることがあるけど、それは間違いだよ。
88,easy,ネズミも笑い声をあげる動物です。しかし、その声は人間には聞こえません。その理由はなんでしょうか？,声が高すぎるから,声が高すぎるから,声が小さすぎるから,声が低すぎるから,声が響かないから,人間の耳が聞き取れる音は、およそ20Hz（ヘルツ）～20000Hzと言われているよ。しかし、ネズミの笑い声は、50000Hzという若い人でも聞き取れないレベルの甲高いものだから聞き取れないんだ。,人間の耳が聞き取れる音は、およそ20Hz（ヘルツ）～20000Hzと言われているよ。しかし、ネズミの笑い声は、声が小さいから聞こえない訳じゃないんだ。,人間の耳が聞き取れる音は、およそ20Hz（ヘルツ）～20000Hzと言われているよ。しかし、ネズミの笑い声は、声が低すぎるから聞こえない訳じゃないんだ。,人間の耳が聞き取れる音は、およそ20Hz（ヘルツ）～20000Hzと言われているよ。しかし、ネズミの笑い声は、声が響かないから聞こえない訳じゃないんだ。
89,easy,目が見えない人を助ける「盲導犬」。彼らに指示を出すために使われるのは日本語ではありません。では、どの国の言葉で指示を出しているでしょうか？,英語,英語,フランス語,ドイツ語,ロシア語,盲導犬には、「ゴー（進め）」・「ライト（右へ）」・「レフト（左へ）」といった具合に英語で指示を出します。性別や地域に関係なく同じ指示を出せる言葉として、盲導犬への指示には英語が採用されるようになりました。,盲導犬に指示を出す言葉は、フランス語ではないよ。,盲導犬に指示を出す言葉は、ドイツ語ではないよ。,盲導犬に指示を出す言葉は、ロシア語ではないよ。
90,normal,フラミンゴが水の中で片足立ちをする理由はなんでしょうか？,体温が下がり過ぎないようにするため,逆に２本足だと上手く立てないから,バランス感覚が良いオスがモテるから,体温が下がり過ぎないようにするため,敵から逃げる時に逃げやすいから,フラミンゴは、水辺で生活する鳥です。２本足だと上手く立てない訳ではないよ。温かい時期は２本足で立っているよ。,フラミンゴは、水辺で生活する鳥です。バランス感覚の良いオスがモテるから片足立ちする訳ではないよ。,フラミンゴは、水辺で生活する鳥です。両足を水に入れたまま過ごすと体温が下がり過ぎてしまうため、それを防ぐために交互に足を入れ替えながら片足で立つようになったと言われているよ。,フラミンゴは、水辺で生活する鳥です。敵から逃げやすくするために片足立ちしている訳ではないよ。
